{
  "schemaVersion": 2,
  "engine": {
    "name": "devflow-execution",
    "contractVersion": "2.0"
  },
  "project": {
    "id": "<project-slug>",
    "planningVersion": 1
  },
  "revision": 0,
  "status": "initialized",
  "policy": {
    "defaultMaxAttempts": 3,
    "maxConcurrentTasks": 1
  },
  "tasks": [],
  "timestamps": {
    "createdAt": null,
    "updatedAt": null
  }
}
